2025-12-16 23:03:56,279 [INFO] ============================================================
2025-12-16 23:03:56,279 [INFO] Hierarchical Fine-Tuning with Pruning Experiment
2025-12-16 23:03:56,279 [INFO] ============================================================
2025-12-16 23:03:56,279 [INFO] Device: cuda:0
2025-12-16 23:03:56,280 [INFO] Models: resnet18, mobilenet
2025-12-16 23:03:56,280 [INFO] Experiment: revised
2025-12-16 23:03:56,280 [INFO] Seed: 888
2025-12-16 23:03:56,280 [INFO] Pruning rates: [0.2, 0.3, 0.5, 0.7]
2025-12-16 23:03:56,280 [INFO] ============================================================
2025-12-16 23:03:56,281 [INFO] 
############################################################
2025-12-16 23:03:56,281 [INFO] Evaluating: RESNET18
2025-12-16 23:03:56,281 [INFO] ############################################################
2025-12-16 23:03:56,281 [INFO] 
============================================================
2025-12-16 23:03:56,281 [INFO] Child Model Experiment (resnet18): 6-class ¡ú 12-class
2025-12-16 23:03:56,281 [INFO] ============================================================
2025-12-16 23:03:56,283 [INFO] Found 1 trained child models: [0]
2025-12-16 23:03:56,283 [INFO] 
Child Model 0 (from Parent 0, resnet18, 12-class)
2025-12-16 23:03:56,283 [INFO] Classes: [37, 173, 157, 91, 43, 141, 182, 169, 155, 46, 98, 74]
2025-12-16 23:05:19,878 [INFO]   Unpruned: 29.17%
2025-12-16 23:05:19,979 [INFO]   [DEBUG] Pruning 20%: 2234600/11173056 params zeroed (20.00%)
2025-12-16 23:05:19,986 [INFO]   Pruned 20%: 20.83% (Sparsity: 20.00%)
2025-12-16 23:05:20,052 [INFO]   [DEBUG] Pruning 30%: 3351907/11173056 params zeroed (30.00%)
2025-12-16 23:05:20,061 [INFO]   Pruned 30%: 16.67% (Sparsity: 30.00%)
2025-12-16 23:05:20,125 [INFO]   [DEBUG] Pruning 50%: 5586528/11173056 params zeroed (50.00%)
2025-12-16 23:05:20,134 [INFO]   Pruned 50%: 16.67% (Sparsity: 50.00%)
2025-12-16 23:05:20,204 [INFO]   [DEBUG] Pruning 70%: 7821128/11173056 params zeroed (70.00%)
2025-12-16 23:05:20,212 [INFO]   Pruned 70%: 16.67% (Sparsity: 70.00%)
2025-12-16 23:05:20,260 [INFO] 
############################################################
2025-12-16 23:05:20,260 [INFO] Evaluating: MOBILENET
2025-12-16 23:05:20,261 [INFO] ############################################################
2025-12-16 23:05:20,261 [INFO] 
============================================================
2025-12-16 23:05:20,261 [INFO] Child Model Experiment (mobilenet): 6-class ¡ú 12-class
2025-12-16 23:05:20,261 [INFO] ============================================================
2025-12-16 23:05:20,261 [INFO] Found 1 trained child models: [0]
2025-12-16 23:05:20,262 [INFO] 
Child Model 0 (from Parent 0, mobilenet, 12-class)
2025-12-16 23:05:20,262 [INFO] Classes: [37, 173, 157, 91, 43, 141, 182, 169, 155, 46, 98, 74]
2025-12-16 23:06:45,852 [INFO]   Unpruned: 25.00%
2025-12-16 23:06:45,893 [INFO]   [DEBUG] Pruning 20%: 441006/2205120 params zeroed (20.00%)
2025-12-16 23:06:45,900 [INFO]   Pruned 20%: 29.17% (Sparsity: 20.00%)
2025-12-16 23:06:45,964 [INFO]   [DEBUG] Pruning 30%: 661513/2205120 params zeroed (30.00%)
2025-12-16 23:06:45,972 [INFO]   Pruned 30%: 12.50% (Sparsity: 30.00%)
2025-12-16 23:06:46,039 [INFO]   [DEBUG] Pruning 50%: 1102560/2205120 params zeroed (50.00%)
2025-12-16 23:06:46,049 [INFO]   Pruned 50%: 4.17% (Sparsity: 50.00%)
2025-12-16 23:06:46,119 [INFO]   [DEBUG] Pruning 70%: 1543565/2205120 params zeroed (70.00%)
2025-12-16 23:06:46,129 [INFO]   Pruned 70%: 4.17% (Sparsity: 70.00%)
2025-12-16 23:06:46,159 [INFO] 
============================================================
2025-12-16 23:06:46,159 [INFO] Results saved to: ./results\pruning_results_revised_20251216_230356.json
2025-12-16 23:06:46,159 [INFO] ============================================================
2025-12-16 23:06:46,159 [INFO] 
EXPERIMENT SUMMARY
2025-12-16 23:06:46,159 [INFO] ============================================================
2025-12-16 23:06:46,160 [INFO] 
[RESNET18]
2025-12-16 23:06:46,160 [INFO] 
  Child Models (12-class): 1 models
2025-12-16 23:06:46,160 [INFO]     Unpruned: 29.17%
2025-12-16 23:06:46,160 [INFO]     Pruned 20%: 20.83%
2025-12-16 23:06:46,160 [INFO]     Pruned 30%: 16.67%
2025-12-16 23:06:46,160 [INFO]     Pruned 50%: 16.67%
2025-12-16 23:06:46,160 [INFO]     Pruned 70%: 16.67%
2025-12-16 23:06:46,160 [INFO] 
[MOBILENET]
2025-12-16 23:06:46,160 [INFO] 
  Child Models (12-class): 1 models
2025-12-16 23:06:46,160 [INFO]     Unpruned: 25.00%
2025-12-16 23:06:46,160 [INFO]     Pruned 20%: 29.17%
2025-12-16 23:06:46,160 [INFO]     Pruned 30%: 12.50%
2025-12-16 23:06:46,160 [INFO]     Pruned 50%: 4.17%
2025-12-16 23:06:46,161 [INFO]     Pruned 70%: 4.17%
2025-12-16 23:06:46,161 [INFO] 
============================================================
2025-12-16 23:06:46,161 [INFO] WEIGHTED AVERAGE (50% RESNET18 + 50% MOBILENET)
2025-12-16 23:06:46,161 [INFO] ============================================================
2025-12-16 23:06:46,161 [INFO] 
Child Models (12-class):
2025-12-16 23:06:46,161 [INFO]   Unpruned: 27.08%
2025-12-16 23:06:46,161 [INFO]   Pruned 20%: 25.00%
2025-12-16 23:06:46,161 [INFO]   Pruned 30%: 14.58%
2025-12-16 23:06:46,161 [INFO]   Pruned 50%: 10.42%
2025-12-16 23:06:46,161 [INFO]   Pruned 70%: 10.42%
