2025-12-16 22:34:54,759 [INFO] ============================================================
2025-12-16 22:34:54,759 [INFO] Hierarchical Fine-Tuning with Pruning Experiment
2025-12-16 22:34:54,759 [INFO] ============================================================
2025-12-16 22:34:54,759 [INFO] Device: cuda:0
2025-12-16 22:34:54,760 [INFO] Models: resnet18, mobilenet
2025-12-16 22:34:54,760 [INFO] Experiment: rebuttal
2025-12-16 22:34:54,760 [INFO] Seed: 888
2025-12-16 22:34:54,760 [INFO] Pruning rates: [0.2, 0.3, 0.5, 0.7]
2025-12-16 22:34:54,760 [INFO] ============================================================
2025-12-16 22:34:54,760 [INFO] 
############################################################
2025-12-16 22:34:54,761 [INFO] Evaluating: RESNET18
2025-12-16 22:34:54,761 [INFO] ############################################################
2025-12-16 22:34:54,761 [INFO] 
============================================================
2025-12-16 22:34:54,761 [INFO] Child Model Experiment (resnet18): 6-class ¡ú 6-class
2025-12-16 22:34:54,761 [INFO] ============================================================
2025-12-16 22:34:54,762 [INFO] Found 1 trained child models: [0]
2025-12-16 22:34:54,762 [INFO] 
Child Model 0 (from Parent 0, resnet18, 6-class)
2025-12-16 22:34:54,762 [INFO] Classes: [182, 116, 184, 178, 188, 55]
2025-12-16 22:36:19,570 [INFO]   Unpruned: 87.18%
2025-12-16 22:36:19,680 [INFO]   [DEBUG] Pruning 20%: 2233986/11169984 params zeroed (20.00%)
2025-12-16 22:36:19,697 [INFO]   Pruned 20%: 85.90% (Sparsity: 20.00%)
2025-12-16 22:36:19,762 [INFO]   [DEBUG] Pruning 30%: 3350986/11169984 params zeroed (30.00%)
2025-12-16 22:36:19,783 [INFO]   Pruned 30%: 88.46% (Sparsity: 30.00%)
2025-12-16 22:36:19,871 [INFO]   [DEBUG] Pruning 50%: 5584993/11169984 params zeroed (50.00%)
2025-12-16 22:36:19,894 [INFO]   Pruned 50%: 80.77% (Sparsity: 50.00%)
2025-12-16 22:36:19,957 [INFO]   [DEBUG] Pruning 70%: 7818979/11169984 params zeroed (70.00%)
2025-12-16 22:36:19,978 [INFO]   Pruned 70%: 51.28% (Sparsity: 70.00%)
2025-12-16 22:36:20,021 [INFO] 
############################################################
2025-12-16 22:36:20,022 [INFO] Evaluating: MOBILENET
2025-12-16 22:36:20,022 [INFO] ############################################################
2025-12-16 22:36:20,022 [INFO] 
============================================================
2025-12-16 22:36:20,023 [INFO] Child Model Experiment (mobilenet): 6-class ¡ú 6-class
2025-12-16 22:36:20,023 [INFO] ============================================================
2025-12-16 22:36:20,023 [INFO] Found 1 trained child models: [0]
2025-12-16 22:36:20,023 [INFO] 
Child Model 0 (from Parent 0, mobilenet, 6-class)
2025-12-16 22:36:20,023 [INFO] Classes: [182, 116, 184, 178, 188, 55]
2025-12-16 22:37:43,374 [INFO]   Unpruned: 85.90%
2025-12-16 22:37:43,407 [INFO]   [DEBUG] Pruning 20%: 439470/2197440 params zeroed (20.00%)
2025-12-16 22:37:43,428 [INFO]   Pruned 20%: 70.51% (Sparsity: 20.00%)
2025-12-16 22:37:43,489 [INFO]   [DEBUG] Pruning 30%: 659209/2197440 params zeroed (30.00%)
2025-12-16 22:37:43,511 [INFO]   Pruned 30%: 61.54% (Sparsity: 30.00%)
2025-12-16 22:37:43,578 [INFO]   [DEBUG] Pruning 50%: 1098720/2197440 params zeroed (50.00%)
2025-12-16 22:37:43,604 [INFO]   Pruned 50%: 25.64% (Sparsity: 50.00%)
2025-12-16 22:37:43,675 [INFO]   [DEBUG] Pruning 70%: 1538189/2197440 params zeroed (70.00%)
2025-12-16 22:37:43,698 [INFO]   Pruned 70%: 19.23% (Sparsity: 70.00%)
2025-12-16 22:37:43,728 [INFO] 
============================================================
2025-12-16 22:37:43,729 [INFO] Results saved to: ./results\pruning_results_rebuttal_20251216_223454.json
2025-12-16 22:37:43,729 [INFO] ============================================================
2025-12-16 22:37:43,729 [INFO] 
EXPERIMENT SUMMARY
2025-12-16 22:37:43,729 [INFO] ============================================================
2025-12-16 22:37:43,729 [INFO] 
[RESNET18]
2025-12-16 22:37:43,729 [INFO] 
  Child Models (6-class): 1 models
2025-12-16 22:37:43,729 [INFO]     Unpruned: 87.18%
2025-12-16 22:37:43,729 [INFO]     Pruned 20%: 85.90%
2025-12-16 22:37:43,730 [INFO]     Pruned 30%: 88.46%
2025-12-16 22:37:43,730 [INFO]     Pruned 50%: 80.77%
2025-12-16 22:37:43,730 [INFO]     Pruned 70%: 51.28%
2025-12-16 22:37:43,730 [INFO] 
[MOBILENET]
2025-12-16 22:37:43,730 [INFO] 
  Child Models (6-class): 1 models
2025-12-16 22:37:43,730 [INFO]     Unpruned: 85.90%
2025-12-16 22:37:43,730 [INFO]     Pruned 20%: 70.51%
2025-12-16 22:37:43,730 [INFO]     Pruned 30%: 61.54%
2025-12-16 22:37:43,731 [INFO]     Pruned 50%: 25.64%
2025-12-16 22:37:43,731 [INFO]     Pruned 70%: 19.23%
2025-12-16 22:37:43,731 [INFO] 
============================================================
2025-12-16 22:37:43,731 [INFO] WEIGHTED AVERAGE (50% RESNET18 + 50% MOBILENET)
2025-12-16 22:37:43,731 [INFO] ============================================================
2025-12-16 22:37:43,731 [INFO] 
Child Models (6-class):
2025-12-16 22:37:43,731 [INFO]   Unpruned: 86.54%
2025-12-16 22:37:43,731 [INFO]   Pruned 20%: 78.21%
2025-12-16 22:37:43,732 [INFO]   Pruned 30%: 75.00%
2025-12-16 22:37:43,732 [INFO]   Pruned 50%: 53.21%
2025-12-16 22:37:43,732 [INFO]   Pruned 70%: 35.26%
