2025-12-16 22:45:28,901 [INFO] ============================================================
2025-12-16 22:45:28,901 [INFO] Hierarchical Fine-Tuning with Pruning Experiment
2025-12-16 22:45:28,901 [INFO] ============================================================
2025-12-16 22:45:28,901 [INFO] Device: cuda:0
2025-12-16 22:45:28,901 [INFO] Models: resnet18, mobilenet
2025-12-16 22:45:28,901 [INFO] Experiment: revised
2025-12-16 22:45:28,901 [INFO] Seed: 888
2025-12-16 22:45:28,901 [INFO] Pruning rates: [0.2, 0.3, 0.5, 0.7]
2025-12-16 22:45:28,901 [INFO] ============================================================
2025-12-16 22:45:28,902 [INFO] 
############################################################
2025-12-16 22:45:28,902 [INFO] Evaluating: RESNET18
2025-12-16 22:45:28,902 [INFO] ############################################################
2025-12-16 22:45:28,902 [INFO] 
============================================================
2025-12-16 22:45:28,902 [INFO] Child Model Experiment (resnet18): 6-class ¡ú 12-class
2025-12-16 22:45:28,903 [INFO] ============================================================
2025-12-16 22:45:28,903 [INFO] Found 1 trained child models: [0]
2025-12-16 22:45:28,903 [INFO] 
Child Model 0 (from Parent 0, resnet18, 12-class)
2025-12-16 22:45:28,903 [INFO] Classes: [37, 173, 157, 91, 43, 141, 182, 169, 155, 46, 98, 74]
2025-12-16 22:46:55,377 [INFO]   Unpruned: 80.56%
2025-12-16 22:46:55,480 [INFO]   [DEBUG] Pruning 20%: 2234600/11173056 params zeroed (20.00%)
2025-12-16 22:46:55,499 [INFO]   Pruned 20%: 77.78% (Sparsity: 20.00%)
2025-12-16 22:46:55,562 [INFO]   [DEBUG] Pruning 30%: 3351907/11173056 params zeroed (30.00%)
2025-12-16 22:46:55,583 [INFO]   Pruned 30%: 77.78% (Sparsity: 30.00%)
2025-12-16 22:46:55,647 [INFO]   [DEBUG] Pruning 50%: 5586528/11173056 params zeroed (50.00%)
2025-12-16 22:46:55,669 [INFO]   Pruned 50%: 63.89% (Sparsity: 50.00%)
2025-12-16 22:46:55,735 [INFO]   [DEBUG] Pruning 70%: 7821128/11173056 params zeroed (70.00%)
2025-12-16 22:46:55,756 [INFO]   Pruned 70%: 27.78% (Sparsity: 70.00%)
2025-12-16 22:46:55,801 [INFO] 
############################################################
2025-12-16 22:46:55,801 [INFO] Evaluating: MOBILENET
2025-12-16 22:46:55,801 [INFO] ############################################################
2025-12-16 22:46:55,801 [INFO] 
============================================================
2025-12-16 22:46:55,801 [INFO] Child Model Experiment (mobilenet): 6-class ¡ú 12-class
2025-12-16 22:46:55,801 [INFO] ============================================================
2025-12-16 22:46:55,802 [INFO] Found 1 trained child models: [0]
2025-12-16 22:46:55,802 [INFO] 
Child Model 0 (from Parent 0, mobilenet, 12-class)
2025-12-16 22:46:55,802 [INFO] Classes: [37, 173, 157, 91, 43, 141, 182, 169, 155, 46, 98, 74]
2025-12-16 22:48:24,488 [INFO]   Unpruned: 77.78%
2025-12-16 22:48:24,526 [INFO]   [DEBUG] Pruning 20%: 441006/2205120 params zeroed (20.00%)
2025-12-16 22:48:24,546 [INFO]   Pruned 20%: 63.89% (Sparsity: 20.00%)
2025-12-16 22:48:24,615 [INFO]   [DEBUG] Pruning 30%: 661513/2205120 params zeroed (30.00%)
2025-12-16 22:48:24,634 [INFO]   Pruned 30%: 41.67% (Sparsity: 30.00%)
2025-12-16 22:48:24,711 [INFO]   [DEBUG] Pruning 50%: 1102560/2205120 params zeroed (50.00%)
2025-12-16 22:48:24,731 [INFO]   Pruned 50%: 11.11% (Sparsity: 50.00%)
2025-12-16 22:48:24,811 [INFO]   [DEBUG] Pruning 70%: 1543565/2205120 params zeroed (70.00%)
2025-12-16 22:48:24,832 [INFO]   Pruned 70%: 9.72% (Sparsity: 70.00%)
2025-12-16 22:48:24,861 [INFO] 
============================================================
2025-12-16 22:48:24,861 [INFO] Results saved to: ./results\pruning_results_revised_20251216_224528.json
2025-12-16 22:48:24,861 [INFO] ============================================================
2025-12-16 22:48:24,861 [INFO] 
EXPERIMENT SUMMARY
2025-12-16 22:48:24,861 [INFO] ============================================================
2025-12-16 22:48:24,861 [INFO] 
[RESNET18]
2025-12-16 22:48:24,861 [INFO] 
  Child Models (12-class): 1 models
2025-12-16 22:48:24,861 [INFO]     Unpruned: 80.56%
2025-12-16 22:48:24,861 [INFO]     Pruned 20%: 77.78%
2025-12-16 22:48:24,862 [INFO]     Pruned 30%: 77.78%
2025-12-16 22:48:24,862 [INFO]     Pruned 50%: 63.89%
2025-12-16 22:48:24,862 [INFO]     Pruned 70%: 27.78%
2025-12-16 22:48:24,862 [INFO] 
[MOBILENET]
2025-12-16 22:48:24,862 [INFO] 
  Child Models (12-class): 1 models
2025-12-16 22:48:24,862 [INFO]     Unpruned: 77.78%
2025-12-16 22:48:24,862 [INFO]     Pruned 20%: 63.89%
2025-12-16 22:48:24,862 [INFO]     Pruned 30%: 41.67%
2025-12-16 22:48:24,862 [INFO]     Pruned 50%: 11.11%
2025-12-16 22:48:24,862 [INFO]     Pruned 70%: 9.72%
2025-12-16 22:48:24,862 [INFO] 
============================================================
2025-12-16 22:48:24,862 [INFO] WEIGHTED AVERAGE (50% RESNET18 + 50% MOBILENET)
2025-12-16 22:48:24,862 [INFO] ============================================================
2025-12-16 22:48:24,862 [INFO] 
Child Models (12-class):
2025-12-16 22:48:24,862 [INFO]   Unpruned: 79.17%
2025-12-16 22:48:24,862 [INFO]   Pruned 20%: 70.83%
2025-12-16 22:48:24,862 [INFO]   Pruned 30%: 59.72%
2025-12-16 22:48:24,862 [INFO]   Pruned 50%: 37.50%
2025-12-16 22:48:24,862 [INFO]   Pruned 70%: 18.75%
